{
  "schema_version": 1,
  "id": "partie-demo",
  "nom": "Les Braises d'Ardanne",
  "heros": "Aldric",
  "graine": 424242,
  "mode_mort": "penalite",
  "statut": "en_cours",
  "session": 9,
  "calendrier": {
    "annee": 1,
    "saison": "automne",
    "jour": 41,
    "moment": "crepuscule"
  },
  "lieu_actuel": "lieu_hautebrande_6d02",
  "morts": 1,
  "cree_le": "2026-10-01T19:12:00Z",
  "maj_le": "2026-10-26T21:40:00Z"
}
